{
  "$schema": "../../buaflow/schemas/readiness-manifest.schema.json",
  "schemaVersion": "1.0",
  "project": "<project-name>",
  "profile": "<application-profile>",
  "targetLevel": "R3",
  "commit": "<git-commit-sha>",
  "generatedAt": "YYYY-MM-DDTHH:mm:ss.sssZ",
  "controls": {
    "version-control": { "status": "pending", "evidence": [] },
    "start-path": { "status": "pending", "evidence": [] },
    "primary-flow": { "status": "pending", "evidence": [] },
    "build": { "status": "pending", "evidence": [] },
    "verification": { "status": "pending", "evidence": [] },
    "requirements-traceability": { "status": "pending", "evidence": [] },
    "automated-tests": { "status": "pending", "evidence": [] },
    "persistence": { "status": "pending", "evidence": [] },
    "access-control": { "status": "pending", "evidence": [] },
    "ci": { "status": "pending", "evidence": [] },
    "deployment-package": { "status": "pending", "evidence": [] },
    "runtime-config": { "status": "pending", "evidence": [] },
    "database-migration": { "status": "pending", "evidence": [] },
    "rollback": { "status": "pending", "evidence": [] },
    "secrets-scan": { "status": "pending", "evidence": [] },
    "dependency-scan": { "status": "pending", "evidence": [] },
    "security-controls": { "status": "pending", "evidence": [] },
    "end-to-end-tests": { "status": "pending", "evidence": [] },
    "observability": { "status": "pending", "evidence": [] },
    "health-check": { "status": "pending", "evidence": [] },
    "performance": { "status": "pending", "evidence": [] },
    "accessibility": { "status": "pending", "evidence": [] },
    "sbom": { "status": "pending", "evidence": [] },
    "runbook": { "status": "pending", "evidence": [] },
    "clean-environment": { "status": "pending", "evidence": [] }
  }
}
